{
  "authored": {
    "concepts": {
      "defines": [],
      "uses": []
    },
    "decls": [],
    "deps": {
      "proof": [],
      "statement": []
    },
    "description_md": "A formalizable remark kept at the planned stage to test header-only Lean modules.",
    "doc": "Fixture2000",
    "fidelity": {
      "status": "faithful"
    },
    "id": "Fixture2000.Rem_1",
    "kind": "remark",
    "source": {
      "chapter": "1",
      "label": "Remark 1",
      "pages": [
        3
      ],
      "section": "1.1"
    },
    "statement_md": "The distinguished degree of the zero complex is zero.",
    "tags": [
      "chain-complex",
      "basic"
    ],
    "title": "Remark 1"
  },
  "dependencies": {
    "proof": [],
    "statement": []
  },
  "dependents": [],
  "derived": {
    "decl_info": [],
    "declared_deps": {
      "proof": [],
      "statement": []
    },
    "deps_diff": {
      "declared_not_verified": {
        "proof": [],
        "statement": []
      },
      "verified_not_declared": []
    },
    "file": {
      "lines": 42,
      "path": "HomAlg/Fixture2000/Rem_1.lean",
      "sha256": "c33dd89488ea8e4081d4b8fafde89442e7ab9b38ed77faccbbb12de10a294d7b"
    },
    "imports": {
      "mathlib": [],
      "nodes": []
    },
    "local_status": "planned",
    "sorry_count_text": 0,
    "verified_deps": {
      "proof": [],
      "statement": []
    }
  },
  "global": {
    "blob_url": "https://github.com/example/homalg-db/blob/fixture/HomAlg/Fixture2000/Rem_1.lean#L1",
    "chapter_title": "Toy chain complexes",
    "closure": {
      "blocked_by": []
    },
    "commit": "fixture",
    "decl_axioms": {},
    "dependents": [],
    "doc_authors": [
      "HomAlgDB fixture authors"
    ],
    "doc_title": "Toy chain complexes",
    "doc_year": 2000,
    "headline": "in-progress",
    "rank": 0,
    "reopened": false,
    "status": "planned"
  },
  "lean": {
    "signature_html": "<pre class=\"shiki shiki-themes github-light github-dark\" style=\"--shiki-light:#24292e;--shiki-dark:#e1e4e8;--shiki-light-bg:#fff;--shiki-dark-bg:#24292e\" tabindex=\"0\"><code><span class=\"line\"></span></code></pre>",
    "source_html": "<pre class=\"shiki shiki-themes github-light github-dark\" style=\"--shiki-light:#24292e;--shiki-dark:#e1e4e8;--shiki-light-bg:#fff;--shiki-dark-bg:#24292e\" tabindex=\"0\"><code><span class=\"line\"><span style=\"--shiki-light:#6A737D;--shiki-dark:#6A737D\">/-!</span></span>\n<span class=\"line\"><span style=\"--shiki-light:#6A737D;--shiki-dark:#6A737D\">```yaml node</span></span>\n<span class=\"line\"><span style=\"--shiki-light:#6A737D;--shiki-dark:#6A737D\">{</span></span>\n<span class=\"line\"><span style=\"--shiki-light:#6A737D;--shiki-dark:#6A737D\">  \"id\": \"Fixture2000.Rem_1\",</span></span>\n<span class=\"line\"><span style=\"--shiki-light:#6A737D;--shiki-dark:#6A737D\">  \"kind\": \"remark\",</span></span>\n<span class=\"line\"><span style=\"--shiki-light:#6A737D;--shiki-dark:#6A737D\">  \"doc\": \"Fixture2000\",</span></span>\n<span class=\"line\"><span style=\"--shiki-light:#6A737D;--shiki-dark:#6A737D\">  \"source\": {</span></span>\n<span class=\"line\"><span style=\"--shiki-light:#6A737D;--shiki-dark:#6A737D\">    \"chapter\": \"1\",</span></span>\n<span class=\"line\"><span style=\"--shiki-light:#6A737D;--shiki-dark:#6A737D\">    \"section\": \"1.1\",</span></span>\n<span class=\"line\"><span style=\"--shiki-light:#6A737D;--shiki-dark:#6A737D\">    \"label\": \"Remark 1\",</span></span>\n<span class=\"line\"><span style=\"--shiki-light:#6A737D;--shiki-dark:#6A737D\">    \"pages\": [</span></span>\n<span class=\"line\"><span style=\"--shiki-light:#6A737D;--shiki-dark:#6A737D\">      3</span></span>\n<span class=\"line\"><span style=\"--shiki-light:#6A737D;--shiki-dark:#6A737D\">    ]</span></span>\n<span class=\"line\"><span style=\"--shiki-light:#6A737D;--shiki-dark:#6A737D\">  },</span></span>\n<span class=\"line\"><span style=\"--shiki-light:#6A737D;--shiki-dark:#6A737D\">  \"title\": \"Remark 1\",</span></span>\n<span class=\"line\"><span style=\"--shiki-light:#6A737D;--shiki-dark:#6A737D\">  \"tags\": [</span></span>\n<span class=\"line\"><span style=\"--shiki-light:#6A737D;--shiki-dark:#6A737D\">    \"chain-complex\",</span></span>\n<span class=\"line\"><span style=\"--shiki-light:#6A737D;--shiki-dark:#6A737D\">    \"basic\"</span></span>\n<span class=\"line\"><span style=\"--shiki-light:#6A737D;--shiki-dark:#6A737D\">  ],</span></span>\n<span class=\"line\"><span style=\"--shiki-light:#6A737D;--shiki-dark:#6A737D\">  \"concepts\": {</span></span>\n<span class=\"line\"><span style=\"--shiki-light:#6A737D;--shiki-dark:#6A737D\">    \"defines\": [],</span></span>\n<span class=\"line\"><span style=\"--shiki-light:#6A737D;--shiki-dark:#6A737D\">    \"uses\": []</span></span>\n<span class=\"line\"><span style=\"--shiki-light:#6A737D;--shiki-dark:#6A737D\">  },</span></span>\n<span class=\"line\"><span style=\"--shiki-light:#6A737D;--shiki-dark:#6A737D\">  \"deps\": {</span></span>\n<span class=\"line\"><span style=\"--shiki-light:#6A737D;--shiki-dark:#6A737D\">    \"statement\": [],</span></span>\n<span class=\"line\"><span style=\"--shiki-light:#6A737D;--shiki-dark:#6A737D\">    \"proof\": []</span></span>\n<span class=\"line\"><span style=\"--shiki-light:#6A737D;--shiki-dark:#6A737D\">  },</span></span>\n<span class=\"line\"><span style=\"--shiki-light:#6A737D;--shiki-dark:#6A737D\">  \"decls\": [],</span></span>\n<span class=\"line\"><span style=\"--shiki-light:#6A737D;--shiki-dark:#6A737D\">  \"fidelity\": {</span></span>\n<span class=\"line\"><span style=\"--shiki-light:#6A737D;--shiki-dark:#6A737D\">    \"status\": \"faithful\"</span></span>\n<span class=\"line\"><span style=\"--shiki-light:#6A737D;--shiki-dark:#6A737D\">  }</span></span>\n<span class=\"line\"><span style=\"--shiki-light:#6A737D;--shiki-dark:#6A737D\">}</span></span>\n<span class=\"line\"><span style=\"--shiki-light:#6A737D;--shiki-dark:#6A737D\">```</span></span>\n<span class=\"line\"></span>\n<span class=\"line\"><span style=\"--shiki-light:#6A737D;--shiki-dark:#6A737D\">## Statement</span></span>\n<span class=\"line\"></span>\n<span class=\"line\"><span style=\"--shiki-light:#6A737D;--shiki-dark:#6A737D\">The distinguished degree of the zero complex is zero.</span></span>\n<span class=\"line\"></span>\n<span class=\"line\"><span style=\"--shiki-light:#6A737D;--shiki-dark:#6A737D\">## Description</span></span>\n<span class=\"line\"></span>\n<span class=\"line\"><span style=\"--shiki-light:#6A737D;--shiki-dark:#6A737D\">A formalizable remark kept at the planned stage to test header-only Lean modules.</span></span>\n<span class=\"line\"><span style=\"--shiki-light:#6A737D;--shiki-dark:#6A737D\">-/</span></span>\n<span class=\"line\"></span></code></pre>",
    "source_text": "/-!\n```yaml node\n{\n  \"id\": \"Fixture2000.Rem_1\",\n  \"kind\": \"remark\",\n  \"doc\": \"Fixture2000\",\n  \"source\": {\n    \"chapter\": \"1\",\n    \"section\": \"1.1\",\n    \"label\": \"Remark 1\",\n    \"pages\": [\n      3\n    ]\n  },\n  \"title\": \"Remark 1\",\n  \"tags\": [\n    \"chain-complex\",\n    \"basic\"\n  ],\n  \"concepts\": {\n    \"defines\": [],\n    \"uses\": []\n  },\n  \"deps\": {\n    \"statement\": [],\n    \"proof\": []\n  },\n  \"decls\": [],\n  \"fidelity\": {\n    \"status\": \"faithful\"\n  }\n}\n```\n\n## Statement\n\nThe distinguished degree of the zero complex is zero.\n\n## Description\n\nA formalizable remark kept at the planned stage to test header-only Lean modules.\n-/\n"
  },
  "links": {
    "github_blame": "https://github.com/example/homalg-db/blame/fixture/HomAlg/Fixture2000/Rem_1.lean#L1",
    "github_blob": "https://github.com/example/homalg-db/blob/fixture/HomAlg/Fixture2000/Rem_1.lean#L1"
  },
  "relations": [],
  "summary": {
    "chapter": "1",
    "concepts_defines": [],
    "concepts_uses": [],
    "decl_names": [],
    "deps_mismatch": false,
    "disputed": false,
    "doc": "Fixture2000",
    "fidelity_status": "faithful",
    "has_mathlib": false,
    "headline": "in-progress",
    "id": "Fixture2000.Rem_1",
    "is_aux": false,
    "kind": "remark",
    "label": "Remark 1",
    "local_id": "Rem_1",
    "local_status": "planned",
    "needs_repair": false,
    "pages": [
      3
    ],
    "rank": 0,
    "reopened": false,
    "reviewed": false,
    "section": "1.1",
    "statement_first_line": "The distinguished degree of the zero complex is zero.",
    "status": "planned",
    "tags": [
      "basic",
      "chain-complex"
    ],
    "title": "Remark 1"
  }
}
