{
  "authored": {
    "concepts": {
      "defines": [],
      "uses": [
        "chain-complex"
      ]
    },
    "decls": [],
    "deps": {
      "proof": [],
      "statement": []
    },
    "description_md": "A planned remark used to exercise the data contract.",
    "doc": "Fixture2000",
    "fidelity": {
      "status": "faithful"
    },
    "id": "Fixture2000.Rem_1",
    "kind": "remark",
    "source": {
      "chapter": "1",
      "label": "Remark 1",
      "pages": [
        3
      ],
      "section": "1.1"
    },
    "statement_md": "The toy complex is indexed by natural numbers.",
    "tags": [
      "chain-complex"
    ]
  },
  "dependencies": {
    "proof": [],
    "statement": []
  },
  "dependents": [],
  "derived": {
    "decl_info": [],
    "declared_deps": {
      "proof": [],
      "statement": []
    },
    "deps_diff": {
      "declared_not_verified": {
        "proof": [],
        "statement": []
      },
      "verified_not_declared": []
    },
    "file": {
      "lines": 1,
      "path": "HomAlg/Fixture2000/Rem_1.lean",
      "sha256": "0000000000000000000000000000000000000000000000000000000000000000"
    },
    "imports": {
      "mathlib": [],
      "nodes": []
    },
    "local_status": "planned",
    "sorry_count_text": 0,
    "verified_deps": {
      "proof": [],
      "statement": []
    }
  },
  "global": {
    "blob_url": "https://github.com/example/homalg-db/blob/fixture/HomAlg/Fixture2000/Rem_1.lean",
    "closure": {
      "blocked_by": []
    },
    "commit": "fixture",
    "decl_axioms": {},
    "dependents": [],
    "doc_authors": [
      "Fixture Maintainers"
    ],
    "doc_title": "Toy chain complexes",
    "doc_year": 2000,
    "headline": "in-progress",
    "rank": 0,
    "reopened": false,
    "status": "planned"
  },
  "lean": {
    "source_text": "/-! A planned fixture node. -/"
  },
  "links": {
    "github_blame": "https://github.com/example/homalg-db/blame/fixture/HomAlg/Fixture2000/Rem_1.lean",
    "github_blob": "https://github.com/example/homalg-db/blob/fixture/HomAlg/Fixture2000/Rem_1.lean"
  },
  "relations": [],
  "summary": {
    "chapter": "1",
    "concepts_defines": [],
    "concepts_uses": [
      "chain-complex"
    ],
    "decl_names": [],
    "deps_mismatch": false,
    "disputed": false,
    "doc": "Fixture2000",
    "fidelity_status": "faithful",
    "has_mathlib": false,
    "headline": "in-progress",
    "id": "Fixture2000.Rem_1",
    "is_aux": false,
    "kind": "remark",
    "label": "Remark 1",
    "local_id": "Rem_1",
    "local_status": "planned",
    "needs_repair": false,
    "pages": [
      3
    ],
    "rank": 0,
    "reopened": false,
    "reviewed": false,
    "section": "1.1",
    "statement_first_line": "The toy complex is indexed by natural numbers.",
    "status": "planned",
    "tags": [
      "chain-complex"
    ]
  }
}
